{
  "id": "glsl-cosine-palette",
  "name": "Cosine gradient palettes (GLSL)",
  "category": "ui",
  "license": "MIT",
  "source": {
    "url": "https://iquilezles.org/articles/palettes/",
    "path": "apps/shaders/lib/palette.glsl"
  },
  "seams": {
    "inputs": [
      "float t"
    ],
    "outputs": [
      "vec3 rgb"
    ],
    "events": []
  },
  "summary": "palette(t,a,b,c,d) = a + b*cos(2pi(c*t+d)) plus five presets. Formula from Inigo Quilez's article; implementation written fresh (no Shadertoy code).",
  "snap": "#include \"palette.glsl\"; palNeon(t), palSunset(t), ...",
  "trust": {
    "tests": true,
    "maintained": true,
    "security_reviewed": false
  }
}
